{
  "contract": "cadence.project-releases.v1",
  "policies": [
    {
      "id": "policy-semver",
      "context": {
        "authority_id": "local-tracker-fixture",
        "mode": "local",
        "organization_id": null,
        "project": "example",
        "stream": "cli"
      },
      "scheme": "semver",
      "created_at": "2026-09-27T00:00:00Z"
    },
    {
      "id": "policy-calendar",
      "context": {
        "authority_id": "issuer-fixture",
        "mode": "remote",
        "organization_id": "org_fixture",
        "project": "example",
        "stream": "reports"
      },
      "scheme": "calendar",
      "created_at": "2026-09-27T00:00:00Z"
    },
    {
      "id": "policy-named",
      "context": {
        "authority_id": "issuer-fixture",
        "mode": "remote",
        "organization_id": "org_fixture",
        "project": "example",
        "stream": "reports"
      },
      "scheme": "named",
      "created_at": "2026-09-27T00:00:00Z"
    }
  ],
  "releases": [
    {
      "id": "rel-maintenance",
      "context": {
        "authority_id": "local-tracker-fixture",
        "mode": "local",
        "organization_id": null,
        "project": "example",
        "stream": "cli"
      },
      "policy_id": "policy-semver",
      "version": "0.1.1",
      "version_key": "0.1.1",
      "title": "Synthetic 0.1.1",
      "owner": "pm_fixture",
      "state": "published",
      "archived": false,
      "target_date": "2026-10-09",
      "revision": 1,
      "notes": "Synthetic fixture; not a published product.",
      "limitations": [
        "No operational evidence asserted"
      ],
      "milestone_ids": [
        "cloud-outcome"
      ],
      "candidate_id": "candidate-maintenance",
      "publication_id": "pub-maintenance"
    },
    {
      "id": "rel-mainline",
      "context": {
        "authority_id": "local-tracker-fixture",
        "mode": "local",
        "organization_id": null,
        "project": "example",
        "stream": "cli"
      },
      "policy_id": "policy-semver",
      "version": "0.2.0",
      "version_key": "0.2.0",
      "title": "Synthetic 0.2.0",
      "owner": "pm_fixture",
      "state": "published",
      "archived": false,
      "target_date": "2026-10-09",
      "revision": 1,
      "notes": "Synthetic fixture; not a published product.",
      "limitations": [
        "No operational evidence asserted"
      ],
      "milestone_ids": [
        "cloud-outcome"
      ],
      "candidate_id": "candidate-mainline",
      "publication_id": "pub-mainline"
    },
    {
      "id": "rel-next",
      "context": {
        "authority_id": "local-tracker-fixture",
        "mode": "local",
        "organization_id": null,
        "project": "example",
        "stream": "cli"
      },
      "policy_id": "policy-semver",
      "version": "0.3.0-rc.1",
      "version_key": "0.3.0-rc.1",
      "title": "Synthetic 0.3.0-rc.1",
      "owner": "pm_fixture",
      "state": "planned",
      "archived": false,
      "target_date": "2026-10-09",
      "revision": 2,
      "notes": "Synthetic fixture; not a published product.",
      "limitations": [
        "No operational evidence asserted"
      ],
      "milestone_ids": [
        "cloud-outcome"
      ],
      "candidate_id": null,
      "publication_id": null
    },
    {
      "id": "rel-report",
      "context": {
        "authority_id": "issuer-fixture",
        "mode": "remote",
        "organization_id": "org_fixture",
        "project": "example",
        "stream": "reports"
      },
      "policy_id": "policy-calendar",
      "version": "2026.09.0",
      "version_key": "2026.09.0",
      "title": "Synthetic 2026.09.0",
      "owner": "pm_fixture",
      "state": "published",
      "archived": false,
      "target_date": "2026-10-09",
      "revision": 1,
      "notes": "Synthetic fixture; not a published product.",
      "limitations": [
        "No operational evidence asserted"
      ],
      "milestone_ids": [
        "cloud-outcome"
      ],
      "candidate_id": "candidate-report",
      "publication_id": "pub-report"
    },
    {
      "id": "rel-named",
      "context": {
        "authority_id": "issuer-fixture",
        "mode": "remote",
        "organization_id": "org_fixture",
        "project": "example",
        "stream": "reports"
      },
      "policy_id": "policy-named",
      "version": "Autumn Review",
      "version_key": "Autumn Review",
      "title": "Synthetic Autumn Review",
      "owner": "pm_fixture",
      "state": "planned",
      "archived": false,
      "target_date": "2026-10-09",
      "revision": 1,
      "notes": "Synthetic fixture; not a published product.",
      "limitations": [
        "No operational evidence asserted"
      ],
      "milestone_ids": [
        "cloud-outcome"
      ],
      "candidate_id": null,
      "publication_id": null
    }
  ],
  "issue_links": [
    {
      "context": {
        "authority_id": "local-tracker-fixture",
        "mode": "local",
        "organization_id": null,
        "project": "example",
        "stream": "cli"
      },
      "issue_id": "EX-1",
      "issue_type": "bug",
      "release_id": "rel-mainline",
      "kind": "target"
    },
    {
      "context": {
        "authority_id": "local-tracker-fixture",
        "mode": "local",
        "organization_id": null,
        "project": "example",
        "stream": "cli"
      },
      "issue_id": "EX-2",
      "issue_type": "task",
      "release_id": "rel-mainline",
      "kind": "target"
    },
    {
      "context": {
        "authority_id": "local-tracker-fixture",
        "mode": "local",
        "organization_id": null,
        "project": "example",
        "stream": "cli"
      },
      "issue_id": "EX-3",
      "issue_type": "task",
      "release_id": "rel-next",
      "kind": "target"
    },
    {
      "context": {
        "authority_id": "local-tracker-fixture",
        "mode": "local",
        "organization_id": null,
        "project": "example",
        "stream": "cli"
      },
      "issue_id": "EX-1",
      "issue_type": "bug",
      "release_id": "rel-maintenance",
      "kind": "affected"
    }
  ],
  "builds": [
    {
      "id": "build-maintenance",
      "context": {
        "authority_id": "local-tracker-fixture",
        "mode": "local",
        "organization_id": null,
        "project": "example",
        "stream": "cli"
      },
      "sources": [
        {
          "kind": "git",
          "repository": "https://github.com/example/synthetic",
          "commit": "aaaaaaaaaaaaaaaaaaaaaaaaaaaaaaaaaaaaaaaa"
        }
      ],
      "artifacts": [
        {
          "name": "synthetic-cli.tar.gz",
          "location": "https://artifacts.example.com/maintenance",
          "sha256": "1111111111111111111111111111111111111111111111111111111111111111",
          "size": 123
        }
      ],
      "manifest_ref": "fixture://manifest-maintenance",
      "dimensions": [
        {
          "name": "product",
          "value": "0.1.1"
        },
        {
          "name": "remote_protocol",
          "value": "1"
        },
        {
          "name": "database_schema",
          "value": "19"
        },
        {
          "name": "runtime_image",
          "value": "synthetic-image-reference"
        }
      ],
      "declared_compatibility": [
        {
          "dimension": "database_schema",
          "constraint": "declared >=19",
          "evidence_ref": "fixture://compatibility",
          "enforced": false
        }
      ],
      "manifest_sha256": "7777777777777777777777777777777777777777777777777777777777777777"
    },
    {
      "id": "build-mainline",
      "context": {
        "authority_id": "local-tracker-fixture",
        "mode": "local",
        "organization_id": null,
        "project": "example",
        "stream": "cli"
      },
      "sources": [
        {
          "kind": "git",
          "repository": "https://github.com/example/synthetic",
          "commit": "bbbbbbbbbbbbbbbbbbbbbbbbbbbbbbbbbbbbbbbb"
        }
      ],
      "artifacts": [
        {
          "name": "synthetic-cli.tar.gz",
          "location": "https://artifacts.example.com/mainline",
          "sha256": "2222222222222222222222222222222222222222222222222222222222222222",
          "size": 123
        }
      ],
      "manifest_ref": "fixture://manifest-mainline",
      "dimensions": [
        {
          "name": "product",
          "value": "0.2.0"
        },
        {
          "name": "remote_protocol",
          "value": "1"
        },
        {
          "name": "database_schema",
          "value": "19"
        },
        {
          "name": "runtime_image",
          "value": "synthetic-image-reference"
        }
      ],
      "declared_compatibility": [
        {
          "dimension": "database_schema",
          "constraint": "declared >=19",
          "evidence_ref": "fixture://compatibility",
          "enforced": false
        }
      ],
      "manifest_sha256": "7777777777777777777777777777777777777777777777777777777777777777"
    },
    {
      "id": "build-report",
      "context": {
        "authority_id": "issuer-fixture",
        "mode": "remote",
        "organization_id": "org_fixture",
        "project": "example",
        "stream": "reports"
      },
      "sources": [
        {
          "kind": "content",
          "location": "orgfs:/reports/draft",
          "sha256": "3333333333333333333333333333333333333333333333333333333333333333"
        }
      ],
      "artifacts": [
        {
          "name": "report.pdf",
          "location": "orgfs:/reports/snapshot",
          "sha256": "4444444444444444444444444444444444444444444444444444444444444444",
          "size": 456
        }
      ],
      "manifest_ref": "fixture://report-manifest",
      "dimensions": [],
      "declared_compatibility": [],
      "manifest_sha256": "7777777777777777777777777777777777777777777777777777777777777777"
    }
  ],
  "candidates": [
    {